"序號","統一編號","公司名稱","公司所在地","代表人","資本額","核准設立日期"
"1824","82835227","明達科技股份有限公司","臺北市內湖區瑞光路122巷101弄10號","張明雄","450000","1080417"
"1825","82835232","瑞良國際貿易股份有限公司","臺北市士林區天母西路13巷9號2樓","陳奕睿","1000000","1080417"
"1826","82835248","帛冠投資有限公司","臺北市中山區南京東路3段65號10樓","黃麗月","1000000","1080417"
"1827","82835253","富逸生物科技有限公司","臺北市大安區忠孝東路3段305號6樓之1","莊英逸","3000000","1080417"
"1828","82835269","鴻與林股份有限公司","臺北市中山區民權西路20號6樓之7","李若菱","102690000","1080417"
"1829","82835275","大原建築室內裝修有限公司","臺北市信義區忠孝東路5段474號11樓","賴卉蓁","1000000","1080417"
"1830","82835280","昱電企業有限公司","臺北市信義區忠孝東路5段68號29樓","許施秀月","3000000","1080417"
"1831","82835296","羅絲蔓國際創藝設計有限公司","臺北市大安區敦化南路2段11巷30號","林柏宇","1000000","1080417"
"1832","82835303","宇優國際有限公司","臺北市中山區南京東路2段20號9樓之1","楊裕泉","5550000","1080417"
"1833","82835319","美洋國際有限公司","臺北市大安區羅斯福路3段297號5樓","楊貴斐","100000","1080417"
"1834","82835325","所羅門資產管理股份有限公司","臺北市松山區敦化北路222巷25之1號3樓","張家宜","2000000","1080417"
"1835","82835330","查理安得資產管理股份有限公司","臺北市信義區基隆路2段179號15樓之2","彭琳","10000000","1080417"
"1836","82835346","太星綠能有限公司","臺北市中正區重慶南路1段10號8樓之15","Phuan Ling Fong","19500000","1080417"
"1837","82835351","智牧有限公司","臺北市中山區南京東路2段216號8樓","蔡昌富","1000000","1080417"
"1838","82835367","暄友有限公司","臺北市中正區信義路2段161巷2弄1之3號","徐靖欣","600000","1080418"
"1839","82835373","爵奧工程設計有限公司","臺北市松山區塔悠路27號2樓之1","黃能凱","2000000","1080417"
"1840","82835388","長萌美妝有限公司","臺北市中山區長安東路2段230號4樓之8","林長興","500000","1080417"
"1841","82835394","興展業國際股份有限公司","臺北市松山區南京東路4段19號2樓之2","林鎮業","27847000","1080417"
"1842","82835401","科晨健康管理顧問股份有限公司","臺北市信義區基隆路1段155號11樓之5","卓雲珍","2000000","1080417"
"1843","82835417","森鈺國際實業股份有限公司","臺北市大安區復興南路1段283號11樓","蔡昌佑","2000000","1080418"
"1844","82835423","沛德資本有限公司","臺北市大安區復興南路2段293之3號9樓之1","王凱雯","10000000","1080417"
"1845","82835438","緯笠紡織股份有限公司","臺北市中山區民族東路1段60號7樓","林瑞岳","6000000","1080417"
"1846","82835459","大有網路科技有限公司","臺北市大安區忠孝東路3段217巷6弄10號3樓","陳冠樺","700000","1080417"
"1847","82835465","萊音譜有限公司","臺北市中山區中山北路2段93巷5號5樓之1","張偉奇","100000","1080417"
"1848","82835471","大六國際生活有限公司","臺北市內湖區民權東路6段136巷28號5樓","王丞軒","100000","1080417"
"1849","82835486","短波組影像有限公司","臺北市大安區敦化南路1段205號7樓之5","蘇宏修","300000","1080417"
"1850","82835492","組合工枋有限公司","臺北市北投區中和街396號5樓","李俊霖","800000","1080417"
"1851","82835508","秝林環保有限公司","高雄市三民區大中一路231號4樓","柯林麗珠","1000000","1080402"
"1852","82835514","小徑文化有限公司","高雄市苓雅區中正二路56巷26號1樓","鄭淑菁","500000","1080402"
"1853","82835520","祥順服務事業有限公司","高雄市苓雅區新光路38號22樓之5","李展佑","1000000","1080402"
"1854","82835535","尊悅旅行社有限公司","高雄市三民區明仁路16之5號4樓之2","張承傑","6000000","1080402"
"1855","82835541","浤潤有限公司","高雄市林園區東林東路176號1樓","黃慈蓉","900000","1080402"
"1856","82835556","鑫泳溱堂有限公司","高雄市三民區九如一路502號20樓之1","蘇泳溱","500000","1080402"
"1857","82835562","鉅嵐實業有限公司","高雄市岡山區成功路95之5號1樓","張凱鈞","5000000","1080402"
"1858","82835578","家渼室內裝修工程有限公司","高雄市大寮區自由路191號1樓","黃建璋","200000","1080402"
"1859","82835583","玫果研究室有限公司","高雄市楠梓區聖雲街110巷16號1樓","蔡芯玫","100000","1080402"
"1860","82835599","馳森實業有限公司","高雄市苓雅區武昌70巷54之1號1樓","杜文成","500000","1080402"
"1861","82835606","天津餐飲顧問有限公司","高雄市旗山區大同街43號","潘國展","300000","1080402"
"1862","82835612","蔦松景觀設計有限公司","高雄市鳥松區大埤路力行巷90號2樓","張禮維","300000","1080403"
"1863","82835628","森廣建設有限公司","高雄市左營區重信路362號1樓","葉怡屏","5000000","1080403"
"1864","82835633","錴佶模具有限公司","高雄市楠梓區加昌路85號7樓之6","尤一陸","1000000","1080403"
"1865","82835649","阿吉製麵有限公司","高雄市三民區灣興街39巷16號1樓","楊尊吉","2500000","1080403"
"1866","82835654","金勳工程有限公司","高雄市小港區下橫路5之3號1樓","周存豪","200000","1080403"
"1867","82835660","宏凡科技有限公司","高雄市前金區中華三路77之1號7樓之2","陳泓綺","500000","1080403"
"1868","82835676","睿圖企業有限公司","高雄市三民區大裕路51巷18弄5號","潘信村","1000000","1080403"
"1869","82835681","家富美實業有限公司","高雄市岡山區永樂街2巷40號1樓","邱嫈絢","500000","1080403"
"1870","82835697","麗泰股份有限公司","高雄市鼓山區美術南五街81號1樓","杜泰源","194300800","1080403"
"1871","82835704","嘉利端子有限公司","高雄市岡山區崑山東巷12弄13號1樓","鄭嘉漳","2000000","1080403"
"1872","82835710","誠信建築有限公司","高雄市三民區建國三路83號3樓之8","温鎮球","50000","1080403"
"1873","82835726","勝倫創業投資股份有限公司","高雄市苓雅區四維四路2號4樓之2","邱來發","250000","1080403"
"1874","82835731","大員尚青股份有限公司","高雄市苓雅區中正二路175號16樓之1","陳宥誼","1000000","1080403"
"1875","82835747","芊翔茂企業有限公司","高雄市鳳山區經武路378號","謝楠彬","300000","1080403"
"1876","82835752","誠宇數位科技有限公司","高雄市楠梓區壽豐路407號5樓","高誠志","200000","1080403"
"1877","82835768","鑫永固工程有限公司","高雄市鳳山區南正二路178號1樓","王淑婷","500000","1080403"
"1878","82835774","宗介有限公司","高雄市苓雅區中正二路175號16樓之1","陳宗逸","1000000","1080403"
"1879","82835789","上亨國際有限公司","高雄市三民區九如二路198號2樓","劉繼馨","1000000","1080403"
"1880","82835795","興特顧問有限公司","高雄市三民區銀杉街97號1樓","陳志誠","200000","1080403"
"1881","82835802","文宇廣告事業有限公司","高雄市左營區博愛三路510號6樓","黃宇紳","1000000","1080403"
"1882","82835818","藏用軒有限公司","高雄市前金區六合二路160號8樓","陳志清","6000000","1080408"
"1883","82835824","精采生活有限公司","高雄市苓雅區四維四路2號4樓之2","李維","100000","1080408"
"1884","82835839","蘭居家生活行銷有限公司","高雄市三民區民族一路80號7樓之1","黃蘭玉","100000","1080408"
"1885","82835845","皇慶建設有限公司","高雄市鳳山區五甲三路118號2樓","紀雅靜","20000000","1080408"
"1886","82835850","鴻越能源有限公司","高雄市鳳山區永義街38號1樓","宋麗萍","100000","1080408"
"1887","82835866","睿翔科技有限公司","高雄市新興區民權一路251號21樓之1","鍾易晏","1000000","1080408"
"1888","82835872","竑翔國際有限公司","高雄市新興區六合路80號1樓","詹承柏","5000000","1080408"
"1889","82835887","日月燈明有限公司","高雄市小港區高坪二十八街15號1樓","莊晉滕","200000","1080408"
"1890","82835893","金福森濬有限公司","高雄市前金區大同二路8之1號2樓","李洪美菊","200000","1080408"
"1891","82835900","玉川文化投資股份有限公司","高雄市苓雅區和平一路87號8樓之1","陳建甫","1000000","1080408"
"1892","82835916","達磨生技有限公司","高雄市鼓山區龍文街71號10樓之1","李潤姬","3000000","1080408"
"1893","82835922","天天微笑有限公司","高雄市鼓山區中華一路350號12樓之4","張富凱","500000","1080408"
"1894","82835937","永泰物業管理顧問有限公司","高雄市三民區三民街68號2樓","杜永霖","1000000","1080408"
"1895","82835943","小觀點室內裝修設計有限公司","高雄市三民區九如二路255之1號9樓","謝昌佑","200000","1080408"
"1896","82835958","樂水智研有限公司","高雄市前金區中正四路211號18樓之4","謝雲嬌","3000000","1080409"
"1897","82835964","來德順企業有限公司","高雄市大寮區會和二街38號1樓","蔡明德","100000","1080409"
"1898","82835970","成五甲工程百貨有限公司","高雄市三民區民族一路80號15樓之1","汪國星","100000","1080409"
"1899","82835985","燁熹國際有限公司","高雄市左營區裕誠路394號12樓","林緣吉","2000000","1080409"
"1900","82835991","貳階全球貿易有限公司","高雄市左營區辛亥路205之2號1樓","周宛辰","1000000","1080409"
"1901","82836008","之迅科技股份有限公司","高雄市左營區博愛四路2號8樓之2","莊明霖","5000000","1080409"
"1902","82836014","祺準科技有限公司","高雄市楠梓區右昌一巷216弄32號1樓","蔡育章","500000","1080409"
"1903","82836020","創弈生醫股份有限公司","高雄市苓雅區光華一路148之84號","簡玠士","1300000","1080409"
"1904","82836035","瑞遠國際有限公司","高雄市苓雅區和平一路232號2樓","蘇沛琳","1000000","1080409"
"1905","82836041","德樺新材料有限公司","高雄市旗山區樂和街36之6號2樓","郭中興","5000000","1080409"
"1906","82836056","璟瀚建設有限公司","高雄市岡山區大德二路26巷34號1樓","許素環","2000000","1080409"
"1907","82836062","艾力克貿易有限公司","高雄市三民區明誠一路130號","蘇震家","3000000","1080409"
"1908","82836078","台灣弗洛米特有限公司","高雄市苓雅區新光路62巷19號25樓之3","張蕙蘭","750000","1080409"
"1909","82836083","紹華有限公司","高雄市前鎮區一心一路243號12樓之2","吳麗珠","1000000","1080409"
"1910","82836099","艾利庫斯文創有限公司","高雄市新興區中正三路55號28樓","張芮湉","500000","1080409"
"1911","82836106","俊曜精密有限公司","高雄市左營區太華街230號6樓之2","郭曜維","500000","1080409"
"1912","82836112","三廣投資有限公司","高雄市三民區民祥街8號15樓之2","柯俊南","10000000","1080409"
"1913","82836128","台灣隆凡貿易有限公司","高雄市三民區清華街27號14樓之2","顏志勝","30000","1080409"
"1914","82836133","榮智滙有限公司","高雄市三民區安東街64號2樓","盧啟浩","6000000","1080409"
"1915","82836149","綠意人文生命有限公司","高雄市苓雅區四維四路2號4樓之2","鄭坤豪","1000000","1080409"
"1916","82836154","鈦立企業有限公司","高雄市三民區中庸街158巷14號1樓","郭俊佑","500000","1080409"
"1917","82836160","植漾感生技國際有限公司","高雄市新興區八德一路194號10樓之3","林峰","1000000","1080409"
"1918","82836176","伸發工程有限公司","高雄市旗津區旗津三路900巷5弄3號5樓","姜懿真","1500000","1080409"
"1919","82836181","耀珵有限公司","高雄市三民區澄平街256號2樓之1","李威德","1000000","1080409"
"1920","82836197","人人有余國際餐飲有限公司","高雄市苓雅區五福一路187、189號","徐富貴","4000000","1080409"
"1921","82836204","木盆實業有限公司","高雄市苓雅區青年一路8之4號1樓","楊翔如","1000000","1080410"
"1922","82836210","泰豐工程有限公司","高雄市三民區大德街24號1樓","謝萬豐","1000000","1080410"
"1923","82836226","莘奕有限公司","高雄市左營區明華一路210號8樓之3","李旭齡","1600000","1080410"
"1924","82836231","荷葓開發建設有限公司","高雄市左營區翠華路601巷57號1樓","何健賓","500000","1080410"
"1925","82836247","隆楷蕂文創有限公司","高雄市燕巢區燕新二街75號","董玉乾","1000000","1080410"
"1926","82836252","牛丁國際餐飲有限公司","高雄市楠梓區樂群路72巷11號7樓","呂松育","3000000","1080410"
"1927","82836268","歐紐複合材料有限公司","高雄市鳳山區南京路172號5樓之9","蘇芳于","7000000","1080410"
"1928","82836274","朵亞晶工有限公司","高雄市三民區民族一路80號33樓之4","李穎慧","6060000","1080410"
"1929","82836302","福欣來有限公司","高雄市楠梓區啟昌街158號","蕭湘雨","5000","1080410"
"1930","82836318","新欣租賃有限公司","高雄市前鎮區凱旋三路277號1樓","蔡少帆","5000000","1080411"
"1931","82836324","富生吉有限公司","高雄市前鎮區明道路138號1樓","陳銓海","300000","1080410"
"1932","82836339","新垣工程有限公司","高雄市大社區三民路370巷8號1樓","陳盟仁","100000","1080410"
"1933","82836345","鉅盛企管顧問有限公司","高雄市前鎮區廣州三街48號2樓","黃國維","2000000","1080410"
"1934","82836350","加分耕耘國際有限公司","高雄市左營區孟子路673號2樓","蘇美貞","1000000","1080410"
"1935","82836366","允捷建設企業有限公司","高雄市鳥松區美德二街89號1樓","黃于哲","2000000","1080410"
"1936","82836372","永芯企業有限公司","高雄市三民區天津街58號1樓","李以甄","1000000","1080410"
"1937","82836387","勞動力量股份有限公司","高雄市左營區明誠二路332號6樓之2","徐宣豐","500000","1080410"
"1938","82836393","億立食品有限公司","高雄市鼓山區河西一路1255號1樓","趙汝芸","500000","1080410"
"1939","82836400","新一實業有限公司","高雄市鼓山區裕誠路1602號","陳威穎","80000","1080410"
"1940","82836416","閎達工程有限公司","高雄市內門區中正路246號1樓","劉義德","200000","1080411"
"1941","82836422","愉翠有限公司","高雄市左營區城峰路12號5樓之6","袁展翔","6000000","1080411"
"1942","82836437","台珺科技有限公司","高雄市鼓山區河西一路1445號12樓之1","鄒俞庭","300000","1080411"
"1943","82836443","天孋國際事業有限公司","高雄市鳳山區鳳東七街61號1樓","王娜","500000","1080411"
"1944","82836458","迷你豬貿易有限公司","高雄市鳳山區鳳東路506號6樓","鄭婕伶","1000000","1080411"
"1945","82836464","小琉球雲聯惠有限公司","高雄市苓雅區四維四路199號5樓之2","黃俊榮","918000","1080411"
"1946","82836470","豐鉅開發建築股份有限公司","高雄市前鎮區南天街20號1樓","林政良","5000000","1080411"
"1947","82836491","川玉工程有限公司","高雄市鳳山區保泰路456號1樓","陳力纓","5000000","1080411"
"1948","82836507","邦德數位有限公司","高雄市新興區尚義街111號12樓之1","何岳韋","400000","1080411"
"1949","82836513","布剛股份有限公司","高雄市三民區裕誠路62之1號5樓","吳育煌","600000","1080411"
"1950","82836529","鑫滿揚股份有限公司","高雄市前鎮區民權二路6號20樓之1","林奇邦","112709000","1080411"
"1951","82836534","瑋杰科技有限公司","高雄市仁武區仁忠二街31巷2號1樓","魏英傑","1000000","1080411"
"1952","82836540","遠藏廣告有限公司","高雄市左營區文守路200巷2號1樓","劉芝吟","300000","1080411"
"1953","82836555","地道能源開發有限公司","高雄市新興區中正三路55號28樓","吳鎮宇","200000","1080411"
"1954","82836561","福元科技事業有限公司","高雄市三民區覺民路272巷46號1樓","侯金都","60000","1080412"
"1955","82836577","紘海國際貿易有限公司","高雄市苓雅區自強三路3號30樓之12","陳謀立","500000","1080412"
"1956","82836582","杏欣醫務管理顧問有限公司","高雄市鳳山區頂新六街38號13樓之1","謝君屏","1000000","1080412"
"1957","82836598","遠宏土地開發有限公司","高雄市苓雅區四維四路2號8樓之5","吳忠穎","2000000","1080412"
"1958","82836605","正百營造股份有限公司","高雄市苓雅區四維四路2號8樓之5","王進發","22500000","1080416"
"1959","82836611","富勇科技有限公司","高雄市三民區覺民路285巷15號1樓","藍明輝","1000000","1080412"
"1960","82836627","御誠烘焙企業有限公司","高雄市前鎮區光華二路5號13樓","許惠如","1500000","1080412"
"1961","82836632","南和假期旅行社股份有限公司","高雄市苓雅區海邊路65號4樓之3","翁琳育","10000000","1080412"
"1962","82836648","銓興工業有限公司","高雄市燕巢區中民路98號1樓","洪承偉","300000","1080412"
"1963","82836653","萬創集海整合行銷有限公司","高雄市鳳山區新強路167號6樓","施政豪","1000000","1080412"
"1964","82836669","森碩資產管理有限公司","高雄市鳳山區王生明路200號2樓","林榮郎","2000000","1080412"
"1965","82836675","釅韻逸品文化有限公司","高雄市楠梓區裕昌街296巷11號1樓","何信逸","1000000","1080412"
"1966","82836680","和義機械有限公司","高雄市仁武區澄合街289號1樓","洪嘉順","500000","1080412"
"1967","82836696","台灣好物蔬果有限公司","高雄市三民區凱旋一路164巷20弄13號1樓","李惠娜","200000","1080412"
"1968","82836703","泰陽塑膠有限公司","高雄市前鎮區一心二路33號11樓","李俊岳","500000","1080412"
"1969","82836719","桔芙天空國際有限公司","高雄市前金區六合二路107之1號6樓之35","張心惠","200000","1080412"
"1970","82836725","御品事業有限公司","高雄市左營區自由四路468號1樓","劉庭瑋","1000000","1080412"
"1971","82836730","鴻順塗料有限公司","高雄市前鎮區崗山中街103巷6號","洪啓順","100000","1080412"
"1972","82836746","馬元久有限公司","高雄市前金區鼎盛街84號1樓","邱文正","2000000","1080412"
"1973","82836751","承瀚企業有限公司","高雄市前鎮區鎮東一街395巷9號2樓之3","王瑞立","5000000","1080412"
"1974","82836767","和信科技有限公司","高雄市鳳山區新泰街20號11樓","李碧玲","370000","1080412"
"1975","82836773","利晟自動化科技有限公司","高雄市鳳山區北昌五街17號15樓","蔡文立","2000000","1080415"
"1976","82836788","寶承國際貿易有限公司","高雄市前鎮區中山二路2號17樓之8","黃明宗","500000","1080415"
"1977","82836794","鈺強醫療器材有限公司","高雄市三民區民族一路80號15樓之1","蘇家強","500000","1080415"
"1978","82836801","捷上工程有限公司","高雄市仁武區仁林路267巷6弄19之19號","吳應隆","100000","1080415"
"1979","82836817","冠銘模具有限公司","高雄市阿蓮區民權路120巷75號","陳冠中","500000","1080415"
"1980","82836823","遇仙文化事業有限公司","高雄市燕巢區鳳雄里鳳西巷24號","李俊寬","1000000","1080415"
"1981","82836838","新盛鷹架有限公司","高雄市三民區民族一路80號9樓之4","成瑞程","30000","1080415"
"1982","82836844","冠煜資產管理有限公司","高雄市楠梓區興楠路56號1樓","蘇翊綺","100000","1080415"
"1983","82836865","太洋貿易有限公司","高雄市大寮區中興路中興二巷11號1樓","顏伯翰","200000","1080415"
"1984","82836871","元辰投資有限公司","高雄市鳳山區鳳甲路137巷10號1樓","陳天成","29000000","1080415"
"1985","82836886","穀衣創意行銷有限公司","高雄市前金區福音街7之26號","盧美岑","500000","1080415"
"1986","82836892","宏嘉國際有限公司","高雄市鳳山區五甲一路750號12樓之5","鍾金葉","500000","1080415"
"1987","82836909","杜拜車業有限公司","高雄市左營區大中二路558號1樓","吳宥鋐","500000","1080415"
"1988","82836915","威勝顧問有限公司","高雄市楠梓區旗楠路126巷9號2樓","蘇啓瑞","1000000","1080415"
"1989","82836936","翊傑國際貿易投資有限公司","高雄市鼓山區美術東八街22號4樓","羅卓泰","3000000","1080415"
"1990","82836942","金銀河貿易有限公司","高雄市三民區德旺街368號2樓","李明展","1000000","1080415"
"1991","82836957","感謝御茶企業有限公司","高雄市苓雅區廣州一街145之6號","陳東琳","1000000","1080415"
"1992","82836963","三氧企業有限公司","高雄市大社區旗楠路80巷210之4號","辜芊頴","500000","1080415"
"1993","82836979","浤椽資產管理顧問有限公司","高雄市新興區民生一路56號5樓之7","陳思穎","100000","1080416"
"1994","82836984","禾美國際有限公司","高雄市前鎮區新生路9巷39號","鄧筠蓁","500000","1080416"
"1995","82836990","同力新能源有限公司","高雄市三民區同盟三路710號2樓","游双鑌","10000000","1080416"
"1996","82837007","頜塑有限公司","高雄市大寮區拷潭路22號1樓","簡榮昌","1000000","1080416"
"1997","82837013","慷品國際有限公司","高雄市鼓山區華泰路172巷1號5樓之2","王品甯","150000","1080416"
"1998","82837029","立嘉管理顧問有限公司","高雄市新興區中正三路55號28樓","藍湘潔","200000","1080416"
"1999","82837034","金承宏國際有限公司","高雄市彌陀區中正路32號1樓","蔡明昌","500000","1080416"
"2000","82837040","大晉國際企業有限公司","高雄市前鎮區興仁路143號1樓","古志斌","1000000","1080416"
"2001","82837055","合鑫船舶管理顧問有限公司","高雄市苓雅區新光路38號15樓之3","石俊宏","300000","1080416"
"2002","82837061","竑菖有限公司","高雄市三民區立德街24號","顏綺宏","100000","1080416"
"2003","82837077","洋驊貿易有限公司","高雄市前鎮區民權二路6號10樓","范豊明","250000","1080416"
"2004","82837082","優購快科技有限公司","高雄市三民區鼎瑞街111號2樓","鄧博仁","1000000","1080416"
"2005","82837098","加臻冷凍食品有限公司","高雄市三民區民族一路80號10樓之4","周佳音","1000000","1080416"
"2006","82837105","金華陞股份有限公司","高雄市三民區大港街2號","張陽俊","1000000","1080416"
"2007","82837111","尊龍股份有限公司","高雄市新興區七賢二路25號12樓之8","焦經國","1000000","1080416"
"2008","82837127","華育工程有限公司","高雄市前鎮區國光路150號","郭玲妏","2000000","1080416"
"2009","82837132","冠宸室內裝修有限公司","高雄市前鎮區瑞賢街110巷23號1樓","郭昭男","1000000","1080416"
"2010","82837148","宏展聯合國際有限公司","高雄市鼓山區西藏街254號","林建宏","100000","1080417"
"2011","82837153","群益行銷有限公司","高雄市前鎮區中山二路91號10樓之2","郭光偉","1000000","1080417"
"2012","82837169","瑋豐水電有限公司","高雄市三民區陽明路320號1樓","張哲瑋","1000000","1080417"
"2013","82837175","雄緯實業有限公司","高雄市鳳山區林森路139巷50號1樓","朱德雄","1000000","1080417"
"2014","82837180","洲驊貿易有限公司","高雄市前鎮區民權二路6號10樓","范豊明","250000","1080417"
"2015","82837196","寶軍生活館有限公司","高雄市楠梓區德民路946號","陳大千","9000000","1080417"
"2016","82837203","烽富有限公司","高雄市前鎮區二聖二巷21之3號4樓","呂奕嫻","13000000","1080417"
"2017","82837219","冠達能源工程有限公司","高雄市楠梓區樂群路72巷5號9樓","黃冠維","1000000","1080417"
"2018","82837225","皇明有限公司","高雄市大寮區大漢路442之1號","潘瑞芳","301000","1080417"
"2019","82837230","汎桌有限公司","高雄市鳳山區文衡路451號2樓","李雅廷","600000","1080417"
"2020","82837246","華緯貿易有限公司","高雄市三民區撫順街126號1樓","陳力榮","1000000","1080417"
"2021","82837251","興誠國際有限公司","高雄市新興區復興二路161號13樓之3","徐全興","500000","1080417"
"2022","82837267","品帥行銷企業有限公司","高雄市三民區明仁路16之6號16樓之2","黃張水好","100000","1080417"
"2023","82837273","帝雄設計有限公司","高雄市鳳山區鳳東路506號1樓","黃鳳玫","1000000","1080417"
"2024","82837288","敬美學行銷有限公司","高雄市左營區重孝路32巷10號10樓","蘇敬詒","1000000","1080417"
"2025","82837294","宸享自動化有限公司","高雄市苓雅區正大路33號5樓之2","陳亞駿","1000000","1080417"
"2026","82837301","龍鑫有限公司","高雄市三民區民族一路1巷33號1樓","葉鍾璦","16000","1080417"
"2027","82837317","元創實業有限公司","高雄市三民區正忠路105號","鄭舜元","1000000","1080417"
"2028","82837323","勝順有限公司","高雄市仁武區新龍街48號1樓","王誓彬","100000","1080417"
"2029","82837338","鼎晶清潔有限公司","高雄市楠梓區援中路92號2樓","葉建國","1000000","1080417"
"2030","82837344","賀糠寵物國際有限公司","高雄市小港區德仁路77巷92弄10號1樓","劉信宏","20000","1080417"
"2031","82837359","佳乘環保有限公司","高雄市小港區新豐街112號9樓","賴瑞傑","50000","1080417"
"2032","82837365","璿承文教顧問有限公司","高雄市鳳山區新安街55號1樓","黃婷芳","300000","1080417"
