"序號","統一編號","公司名稱","公司所在地","代表人","資本額","核准設立日期"
"2849","82850970","錵饌有限公司","新北市板橋區文化路2段125巷38號1樓","張若葳","1000000","1080418"
"2850","82850985","華生健康管理顧問有限公司","新北市中和區中興街183號2樓","張粹華","100000","1080418"
"2851","82850991","友鑫精密有限公司","新北市樹林區潭興街141巷3號5樓","劉家湧","1000000","1080418"
"2852","82851008","貓咪堡寵物精品有限公司","新北市新莊區中德路10號3樓","顏憶惠","100000","1080418"
"2853","82851014","品苑工程有限公司","新北市林口區文化三路1段617巷88號","徐琬茹","300000","1080418"
"2854","82851020","串宗企業有限公司","新北市新店區玫瑰路55巷40號","鄭宗禮","300000","1080418"
"2855","82851035","順天興業有限公司","新北市蘆洲區集賢路222之6號10樓","吳武建","300000","1080418"
"2856","82851041","致遠精密有限公司","新北市新莊區思源路87巷5號","林瑞明","2000000","1080418"
"2857","82851056","幸運企業有限公司","新北市板橋區四川路2段130巷20之2號","江幸芬","100000","1080418"
"2858","82851062","高醫生技生醫有限公司","新北市中和區安和路69號(1樓)","高偉哲","2000000","1080418"
"2859","82851078","程弘設計工程有限公司","新北市板橋區後菜園街32巷1號4樓","王顥宸","50000","1080418"
"2860","82851083","台灣博微科技股份有限公司","新北市中和區中正路961號18樓","許俊傑","505000","1080418"
"2861","82851099","卓鍵實業有限公司","新北市林口區三民路128之1號13樓","劉坤謀","200000","1080418"
"2862","82851106","禹仕天有限公司","新北市板橋區宏國路40號","陳志豪","300000","1080418"
"2863","82851112","良業塑膠有限公司","新北市土城區金城路3段205之1號12樓","羅業鈞","100000","1080418"
"2864","82851133","匯智數位有限公司","新北市新店區明德路65巷8號2樓","劉誠","1000000","1080418"
"2865","82851149","鑫天下國際生技有限公司","新北市板橋區中山路1段69號7樓","陳文晶","300000","1080418"
"2866","82851154","八月本舖有限公司","新北市新莊區中正路377巷26號7樓","吳企鎧","300000","1080419"
"2867","82851160","風峰有限公司","新北市永和區保生路1號21樓之1","陳薇詩","584600","1080418"
"2868","82851176","金石國際開發有限公司","新北市汐止區大同路1段175號8樓","王慕嚴","20000000","1080418"
"2869","82851181","長富國際股份有限公司","新北市汐止區康寧街169巷25號2樓之1","劉哲瑄","1000000","1080418"
"2870","82851197","鮮到手貿易有限公司","新北市中和區中山路2段305號9樓之18","周子翔","200000","1080418"
"2871","82851204","利陞機械有限公司","新北市樹林區中華路375之1號","陳雅婷","200000","1080418"
"2872","82851210","迷鐵金屬有限公司","新北市板橋區中山路2段367之1號2樓","金伯修","500000","1080418"
"2873","82851226","雄高科技有限公司","新北市五股區中興路1段128巷36號（1樓）","王宇昇","1000000","1080418"
"2874","82851231","盈泰物業管理顧問有限公司","新北市板橋區中正路135巷12弄12號（1樓之3）","劉以羚","100000","1080418"
"2875","82851247","富寓國際有限公司","新北市中和區中和路232號6樓之4","辛珮琪","5000000","1080418"
"2876","82851252","台灣及人汐止新台有限公司","新北市汐止區新台五路1段129號2樓","朱襄陽","50000","1080418"
"2877","82851268","優姿床業有限公司","新北市泰山區明志路3段353號","李曼寧","1500000","1080419"
"2878","82851274","安盛行銷有限公司","新北市泰山區公園路7號7樓","陳秋華","1000000","1080418"
"2879","82851289","立上有限公司","新北市三芝區長勤街48之1號2樓","李云伶","500000","1080418"
"2880","82851295","捷印設計有限公司","新北市永和區民生路67巷40號2樓","林郁伶","2000000","1080418"
"2881","82851302","全宏懋有限公司","新北市土城區和平路46之2號6樓","林峯民","2000000","1080418"
"2882","82851318","家賀國際有限公司","新北市樹林區備內街158巷46號","陳淑婷","500000","1080418"
"2883","82851324","品芙國際有限公司","新北市板橋區文化路1段268號21樓之1","邱君慧","600000","1080419"
"2884","82851339","玹瓏環保科技業有限公司","新北市林口區中華路263號(2樓)","呂沂蓁","1000000","1080419"
"2885","82851345","美詩伊有限公司","新北市土城區亞洲路11巷1弄8號","張和元","500000","1080419"
"2886","82851350","錡昱有限公司","新北市土城區延和路88巷13弄1號","李仁敏","300000","1080419"
"2887","82851366","東冠機械有限公司","新北市中和區建八路169號6樓","余建樺","5000000","1080419"
"2888","82851372","日升不動產工程有限公司","新北市三重區三信路128號","胡盛齡","1000000","1080419"
"2889","82851387","样凱有限公司","新北市板橋區公園街34巷26號","魯耿嘉","2400000","1080419"
"2890","82851393","鵬丞科技股份有限公司","新北市永和區永和路2段57號7樓","張志安","1000000","1080419"
"2891","82851400","樂華有限公司","新北市五股區五權路71號(4樓)","張哲銘","100000","1080419"
"2892","82851416","胜肽渼生物科技有限公司","新北市新店區民權路132號7樓","廖學鄰","5000000","1080419"
"2893","82851422","祥群有限公司","新北市五股區工商路36巷10號","李浩銘","2000000","1080419"
"2894","82851437","悅康悅美有限公司","新北市板橋區漢生西路32號（1樓）","謝悦","100000","1080419"
"2895","82851443","樂芯生技有限公司","新北市永和區中和路343號4樓之3","劉家芸","500000","1080419"
"2896","82851458","火箭果汁遊戲工作室有限公司","新北市烏來區金堰26號之1","凌玉揚","102000","1080419"
"2897","82851464","祥睿資訊管理顧問有限公司","新北市五股區成泰路3段513號5樓","郭清祥","1000000","1080419"
"2898","82851470","諾必達科技有限公司","新北市中和區中山路2段33號10樓之2","黃哲","100000","1080419"
"2899","82851485","彩苙企業有限公司","新北市新店區寶興路45巷6弄4號2樓","賴例容","2000000","1080419"
"2900","82851491","哲禕有限公司","新北市三重區三和路4段101巷3號","蔡旻汎","200000","1080424"
"2901","82851507","禾淥景觀有限公司","新北市汐止區弘道街53巷20弄1號3樓","李秀治","360000","1080419"
"2902","82851513","雲萍沙龍有限公司","新北市三重區集英路71號","謝采彤","1000000","1080419"
"2903","82851529","昱暢科技有限公司","新北市土城區金城路2段260號19樓之4","陳桂鋐","230000","1080419"
"2904","82851534","冠枻有限公司","新北市八里區龍形一街12巷5弄5號","郭明煜","1000000","1080419"
"2905","82851540","遠翔國際有限公司","新北市新莊區福壽街112巷16號6樓","曾聖翔","1000000","1080419"
"2906","82851555","安傑立有限公司","新北市新店區安康路2段36號（1樓）","王復婷","500000","1080419"
"2907","82851561","宸揚商事有限公司","新北市三重區光復路2段87巷61號","鄭明珠","1000000","1080419"
"2908","82851577","艾鴻實業有限公司","新北市三重區仁政街196之1號7樓","李鴻逸","200000","1080419"
"2909","82851582","雨文堂有限公司","新北市樹林區大安路536號9樓","簡奕雯","5000000","1080422"
"2910","82851598","愛西服創意服飾有限公司","新北市板橋區館前東路102號","邱思榮","200000","1080419"
"2911","82851605","旭邦有限公司","新北市鶯歌區光明街100號（1樓）","李芸溱","3000000","1080419"
"2912","82851611","南十字能源開發有限公司","新北市淡水區民權路221號10樓之7","廖宇翔","30000","1080419"
"2913","82851627","祐承實業有限公司","新北市新莊區五權一路1號8樓之2","徐永祥","1000000","1080419"
"2914","82851632","玖揚企業有限公司","新北市土城區中央路3段32號","徐信隆","1000000","1080419"
"2915","82851648","廣輝不動產有限公司","新北市鶯歌區建國路211號","林裕盛","3000000","1080419"
"2916","82851669","瑞碁實業有限公司","新北市板橋區民生路1段59號6樓","張美華","100000","1080419"
"2917","82851675","富鈦光電科技有限公司","新北市中和區民享街95之1號","莊家源","3300000","1080419"
"2918","82851680","憶冠科技有限公司","新北市三峽區大義路255號(1樓)","吳崇榮","200000","1080422"
"2919","82851696","松柏綠電有限公司","新北市淡水區民權路221號10樓之7","廖宇翔","30000","1080422"
"2920","82851703","天能環球事業有限公司","新北市新莊區雙鳳路77巷2號4樓之6","何德玲","1000000","1080422"
"2921","82851719","達旺有限公司","新北市鶯歌區鶯桃路335號5樓","陳冠逸","100000","1080422"
"2922","82851725","沙雷貿易有限公司","新北市樹林區中山路3段121號","GRIGONIS SARUNAS","500000","1080422"
"2923","82851730","威麗管理顧問有限公司","新北市萬里區瑪鋉頂街67號4樓","朱清標","50000","1080422"
"2924","82851746","參參企業有限公司","新北市五股區五福路69號3樓","KUAN PENG CHING","6300000","1080422"
"2925","82851751","力榮科技有限公司","新北市樹林區俊英街116巷41弄27號2樓","陳崑增","500000","1080422"
"2926","82851767","逸龍創國際有限公司","新北市板橋區民生路1段33號20樓之3","葉柏逸","1000000","1080422"
"2927","82851773","羅客股份有限公司","新北市新莊區自信街58之3號","鄭智元","250000","1080422"
"2928","82851788","跳躍子時有限公司","新北市新店區寶元路2段31巷2號","馬武成","500000","1080422"
"2929","82851794","捷銳有限公司","新北市樹林區中山路1段157號11樓之1","張永慧","200000","1080422"
"2930","82851801","卡哇依企業有限公司","新北市新店區中央路155號23樓","王羚喬","200000","1080422"
"2931","82851817","芮思生活有限公司","新北市中和區圓通路296巷33弄12號5樓","吳秉叡","3000000","1080422"
"2932","82851823","晶鴻海洋貿易有限公司","新北市三重區仁興街39巷14之4號(1樓)","曾季鴻","300000","1080422"
"2933","82851838","菜寮不動產仲介經紀有限公司","新北市新莊區復興路2段101之1號","黃建發","300000","1080422"
"2934","82851844","太鎣科技有限公司","新北市板橋區中山路2段62號10樓之7","張欣傑","300000","1080422"
"2935","82851859","三重不動產仲介經紀有限公司","新北市三重區自強路4段80號2樓","李淑芬","300000","1080422"
"2936","82851865","璞和室內裝修設計工程有限公司","新北市板橋區復興街110之1號（2樓）","林怡君","300000","1080422"
"2937","82851871","慶盛不動產有限公司","新北市蘆洲區長榮路353號(1樓)","賴長溪","1000000","1080422"
"2938","82851886","房角石室內裝修工程有限公司","新北市蘆洲區信義路222巷34弄16號(1樓)","沈雅玲","100000","1080423"
"2939","82851892","勝源精密工業有限公司","新北市新店區寶橋路252號(1樓)","何美容","500000","1080422"
"2940","82851909","上欽漁場有限公司","新北市新莊區中華路1段132號","蘇凱傑","300000","1080422"
"2941","82851921","容群有限公司","新北市板橋區長安街251巷2號","何其昌","100000","1080422"
"2942","82851936","其實有限公司","新北市中和區保健路65之1號","錢英凱","1000000","1080422"
"2943","82851942","騰遠企業有限公司","新北市三重區中正北路331巷10弄3號2樓","張立姍","2000000","1080422"
"2944","82851957","專獵牛排有限公司","新北市林口區文化三路1段450號","江宗憲","3000000","1080423"
"2945","82851963","南雅企業有限公司","新北市板橋區南雅南路1 段125號1樓","張倉禎","200000","1080422"
"2946","82851979","惠新工程有限公司","新北市新店區中央路105巷4號14樓","洪慧貞","200000","1080422"
"2947","82851984","鑫大港有限公司","新北市新莊區新樹路609之5號","詹斌","3000000","1080422"
"2948","82851990","喨兆空間設計有限公司","新北市土城區學成路76巷16號2樓之1","柯博仁","2000000","1080422"
"2949","82852007","環盛網路科技有限公司","新北市汐止區新台五路1段97號25樓之11","曾群翰","1000000","1080422"
"2950","82852013","福成得投資有限公司","新北市五股區水碓五路47號","温智超","10000000","1080423"
"2951","82852029","鋒薇有限公司","新北市五股區成泰路3段543巷29號","陳淑珍","1000000","1080423"
"2952","82852034","前程投資股份有限公司","新北市三重區重新路5段609巷4號8樓之8","傅和彥","18400000","1080423"
"2953","82852055","杰慶股份有限公司","新北市板橋區光明街50號(1樓)","簡淑枝","18000000","1080423"
"2954","82852061","墨荒餐飲有限公司","新北市三重區三賢街197號","邱奕宗","3800000","1080423"
"2955","82852077","武田摩多有限公司","新北市中和區景平路63號","林俊榮","2000000","1080423"
"2956","82852082","行家通運有限公司","新北市汐止區仁愛路122巷15號","林賴松","30000000","1080423"
"2957","82852098","塞特科技股份有限公司","新北市新莊區民安路188巷8弄5號7樓之5","陳思宇","1840000","1080423"
"2958","82852105","捷尼思國際股份有限公司","新北市三重區新北大道2段260號14樓","陳昱志","200000","1080423"
"2959","82852111","紀旭設計有限公司","新北市土城區中央路2段61巷44弄8號4樓","林沛緹","1000000","1080423"
"2960","82852127","密斯杰餐飲行銷股份有限公司","新北市汐止區民族六街5巷9號","王德方","5000000","1080423"
"2961","82852132","旺達棉品國際有限公司","新北市中和區中山路2段405號3樓","陳演宗","5000000","1080423"
"2962","82852148","數位共和國股份有限公司","新北市新店區民權路108之4號5樓","闕志勲","3000000","1080423"
"2963","82852153","辰禧企業有限公司","新北市板橋區吳鳳路88號6樓","翁志宏","2000000","1080423"
"2964","82852169","鼎剛毅實業有限公司","新北市板橋區大明街63巷1弄16之2號","高薏惠","1000000","1080423"
"2965","82852175","鑫鑫園藝景觀有限公司","新北市三峽區中山路238巷14號1樓","林民祥","106000","1080423"
"2966","82852180","弋群有限公司","新北市汐止區茄苳路130號13樓","賴建偉","500000","1080423"
"2967","82852196","鼎富食品有限公司","新北市樹林區信義街79號","華祐增","500000","1080423"
"2968","82852203","希米創意廚坊有限公司","新北市蘆洲區長樂路68號","石朝宗","1000000","1080423"
"2969","82852219","巨森整合行銷有限公司","新北市板橋區重慶路245巷80號8樓","陳宣豪","1000000","1080424"
"2970","82852225","森淼生技股份有限公司","新北市中和區景平路268號33樓","周俊亨","15000000","1080424"
"2971","82852230","寶樑有限公司","新北市林口區菁埔33號","周世樑","200000","1080423"
"2972","82852246","湯淳實業有限公司","新北市板橋區中山路1段8號","張祐銘","300000","1080423"
"2973","82852251","光風形和室內設計有限公司","新北市新莊區西盛街323巷7號6樓","邱嫆雅","200000","1080423"
"2974","82852267","建橙開發工程有限公司","新北市中和區民富街42巷2之3號","詹文新","1000000","1080423"
"2975","82852273","迪傑思國際留學代辦股份有限公司","新北市土城區亞洲路58巷3弄18號（1樓）","李培佳","10000","1080423"
"2976","82852288","好漢工程有限公司","新北市林口區中山路51號4樓","王玫文","2000000","1080423"
"2977","82852294","卡帛彩色印刷有限公司","新北市板橋區民生路1段3號16樓","陳浙維","300000","1080423"
"2978","82852301","高效力奈米生技股份有限公司","新北市中和區中和路230巷17號(1樓)","謝承佑","5000000","1080424"
"2979","82852317","萬驛有限公司","新北市三重區重新路2段42號9樓之5","王昱元","400000","1080423"
"2980","82852323","弘綸投資有限公司","新北市林口區粉寮路1段39號3樓","陳名緯","1000000","1080423"
"2981","82852338","豪茶谷有限公司","新北市中和區中山路3段107號","李捷宇","100000","1080423"
"2982","82852344","昕展開發股份有限公司","新北市五股區成泰路1段2號5樓","黃國甄","50000000","1080423"
"2983","82852359","海聚投資有限公司","新北市蘆洲區光榮路122號6樓","陳之怡","300000","1080423"
"2984","82852365","水果大亨股份有限公司","新北市新莊區新莊路54號","許智翔","1000000","1080423"
"2985","82852371","睿辰生醫國際有限公司","新北市中和區中正路926號4樓","曾承宥","2000000","1080423"
"2986","82852386","皇帝世家有限公司","新北市樹林區八德街628巷34號","劉安綺","3000000","1080423"
"2987","82852392","智慧力存有限公司","新北市五股區芳洲五路70號10樓","孫秀菊","1000000","1080423"
"2988","82852409","威嘉工業有限公司","新北市新莊區福前街500之11號4樓","李岳怡","1000000","1080423"
"2989","82852415","威嘉精密有限公司","新北市新莊區福前街500之11號4樓","李岳怡","1000000","1080423"
"2990","82852436","鑫滿溢國際有限公司","新北市新莊區中正路334巷25弄4之2號","林雅翎","500000","1080425"
"2991","82852442","協昌企業有限公司","新北市新莊區新樹路63號（1樓）","潘晴雯","1500000","1080424"
"2992","82852457","白菜科技股份有限公司","新北市汐止區康寧街169巷29之1號3樓","顏裕恭","2223000","1080424"
"2993","82852463","惟新實業有限公司","新北市汐止區伯爵街42巷18號（2樓）","陳芳瑾","1000000","1080424"
"2994","82852479","東琳創新建設股份有限公司","新北市土城區金城路2段269號2樓","吳順農","10000000","1080424"
"2995","82852484","睿宸財務顧問有限公司","新北市新莊區新莊路649巷26弄8號","李思慧","300000","1080424"
"2996","82852490","御石餐飲有限公司","新北市淡水區中正路34號","程家宜","200000","1080424"
"2997","82852506","非力廣告有限公司","新北市淡水區水源街2段177巷53號12樓","盧逸力","200000","1080424"
"2998","82852512","毅齊實業有限公司","新北市永和區仁愛路306巷68號14樓","張玲萍","1000000","1080424"
"2999","82852528","星海資訊股份有限公司","新北市新店區中央四街90號","許美玲","3000000","1080424"
"3000","82852533","莨源企業有限公司","新北市汐止區樟樹一路129巷20弄7號5樓","黃炳輝","3000000","1080424"
"3001","82852549","極光數位科技有限公司","新北市永和區勵行街9巷4號3樓","譚至緯","1000000","1080424"
"3002","82852554","淇梓有限公司","新北市樹林區八德街289號4樓","陳俊諺","500000","1080424"
"3003","82852560","奈德國際實業有限公司","新北市樹林區三俊街81巷28號","黃郁芩","1000000","1080424"
"3004","82852576","梁徐華睿國際有限公司","新北市永和區保生路1號21樓之1","梁徐華睿","6611297","1080424"
"3005","82852581","加淇貿易有限公司","新北市金山區信義路72之1號6樓之2","簡豐裕","300000","1080424"
"3006","82852597","勝滿企業股份有限公司","新北市新店區中興路2段225號20樓","黃詩鈞","3000000","1080425"
"3007","82852604","鴻大針織有限公司","新北市土城區中央路2段21巷110號11樓","陳湘怡","600000","1080424"
"3008","82852610","宏御工程技術顧問有限公司","新北市板橋區中山路1段293之2號9樓之2","魏德禎","1680000","1080424"
"3009","82852626","和光光電股份有限公司","新北市新店區寶橋路235巷16弄8號8樓","湯雅如","30000","1080424"
"3010","82852631","豐穀企業有限公司","新北市新店區大新街7巷14號4樓","陳梓秋","100000","1080424"
"3011","82852647","昌柏人文事業有限公司","新北市新店區安興路125之9號13樓","林慶宗","1000000","1080424"
"3012","82852652","生命故事屋文化科技股份有限公司","新北市新莊區中港路59號2樓","簡佩菁","500000","1080425"
"3013","82852668","鍇叡數位科技股份有限公司","新北市三重區仁華街118巷1之10號","顏宥騫","10000","1080424"
"3014","82852674","俊升網絡科技有限公司","新北市新店區民權路108號10樓","吳健銘","2000000","1080425"
"3015","82852689","天鵝座運動科技有限公司","新北市汐止區建成路178巷2號","何佳洛","301000","1080425"
"3016","82852695","亞美清潔實業有限公司","新北市板橋區三民路2段192號7樓之2","黃意婷","200000","1080424"
"3017","82852702","小石頭國際有限公司","新北市三峽區國際二街9號","郭士綱","300000","1080424"
"3018","82852718","友順畜產有限公司","新北市板橋區三民路1段31巷84號7樓","黃宗仁","1000000","1080424"
"3019","82852724","鑫悅開發有限公司","新北市蘆洲區中山一路99號（2樓）","蔡麗金","500000","1080424"
"3020","82852739","輝煌事業有限公司","新北市永和區中和路429號地下1層","吳錦輝","6100000","1080425"
"3021","82852745","留嬴企業有限公司","新北市新店區民權路188號4樓","江宛栗","250000","1080425"
"3022","82852750","竺云資網有限公司","新北市樹林區名園街22巷5號6樓","林炳憲","700000","1080425"
"3023","82852766","創達光電有限公司","新北市新店區檳榔路41巷2號（1樓）","劉俊欣","100000","1080425"
"3024","82852772","富林科技有限公司","新北市淡水區自強路201巷28之2號","鄭凱廸","1000000","1080425"
"3025","82852787","米樂居家百貨實業有限公司","新北市五股區登林路74之1號","陳姿蓉","500000","1080425"
"3026","82852793","方癸不動產開發股份有限公司","新北市中和區明禮街20之2號","吳方衆","1000000","1080425"
"3027","82852800","旅立旅行社有限公司","新北市新莊區中原路109之1號","連虹雲","6000000","1080425"
"3028","82852816","宸熙建設開發股份有限公司","新北市板橋區重慶路325號(1樓)","洪貴玲","20000000","1080425"
"3029","82852822","本圓易購有限公司","新北市新莊區五工三路50巷21號","李卿綸","300000","1080425"
"3030","82852837","永豫事業股份有限公司","新北市中和區泰和街35之1號","林柏霖","1680000","1080425"
"3031","82852843","佳世開發有限公司","新北市新莊區中原路121號","林承勳","1000000","1080425"
"3032","82852858","立生實業有限公司","新北市新莊區中華路2段11號10樓","唐睬甄","300000","1080425"
"3033","82852864","星際互聯數位科技有限公司","新北市新店區安泰路60巷55弄3號","陳威志","130000","1080425"
"3034","82852870","晁明國際有限公司","新北市蘆洲區復興路282號","盧兆昉","100000","1080425"
"3035","82852885","元邦音響有限公司","新北市新莊區五權一路3號7樓之8","林珮愉","1000000","1080425"
"3036","82852891","樂蓮文化創意有限公司","新北市板橋區僑中二街12巷14之3號","周羿含","300000","1080425"
"3037","82852908","悅色國際有限公司","新北市板橋區新海路370號","王羽婕","1000000","1080425"
"3038","82852914","右岸有限公司","新北市板橋區民生路3段321號37樓之3","廖芸孺","500000","1080425"
"3039","82852920","暐燁企業有限公司","新北市五股區天乙路91號6樓","倪淑芬","1000000","1080425"
"3040","82852935","星盛有限公司","新北市三重區河邊北街160巷18號2樓","馮惠雅","300000","1080425"
"3041","82852941","敦頤國際有限公司","新北市淡水區新春街148之10號（1樓）","沈倩吟","1000000","1080425"
"3042","82852956","川中月生活百貨有限公司","新北市中和區連城路539號13樓","林美月","500000","1080425"
"3043","82852962","昕采裝飾有限公司","新北市永和區竹林路39巷42弄5號(1樓)","林正川","100000","1080425"
"3044","82852978","海月康有限公司","新北市中和區莒光路120巷19弄4號（1樓）","林秀樺","100000","1080425"
"3045","82852983","立宏水電有限公司","新北市泰山區仁義路220巷34號","徐秉瑄","15000000","1080425"
"3046","82852999","樺祥國際有限公司","新北市新莊區思源路173號9樓","賴麗如","54000000","1080425"
"3047","82853006","承豐善澤股份有限公司","新北市三重區慈愛街143號8樓","黃宣文","1000000","1080425"
"3048","82853012","睿安保險代理人股份有限公司","新北市新店區北新路3段207之3號5樓","張立義","5000000","1080425"
"3049","82853028","美夢成真企業有限公司","新北市三峽區弘園街35號14樓","徐家雯","300000","1080426"
"3050","82853033","天恩緣生命禮儀有限公司","新北市板橋區四川路1段23號9樓之1","陳柏豪","100000","1080425"
"3051","82853049","中瑞股份有限公司","新北市林口區麗園二街1巷1號3樓之2","余志中","5500000","1080426"
"3052","82853054","福耀科技有限公司","新北市新莊區新樹路246號","吳進忠","1000000","1080426"
"3053","82853060","麗鈦科技有限公司","新北市鶯歌區光明街202號7樓","陳立璋","500000","1080426"
"3054","82853076","職人治羽生活運動有限公司","新北市板橋區合安一路101號","陳威程","100000","1080426"
"3055","82853081","精英國際工程有限公司","新北市板橋區縣民大道3段223號","孫建國","5000000","1080426"
"3056","82853097","紘秉有限公司","新北市新店區安祥路190巷17號5樓","楊秉森","2000000","1080426"
"3057","82853104","元泰統合行銷有限公司","新北市板橋區篤行路2段77巷9弄9號","孫梓渝","300000","1080426"
"3058","82853110","偉雄建設股份有限公司","新北市新店區永業路81巷5弄13號4樓","程啓謀","5000000","1080426"
